<?xml version="1.0" encoding="UTF-8"?>
<Level-2A_Ground_Image_Processing_Parameter xmlns:xsi="http://www.w3.org/2001/XMLSchema-instance"
                                            xsi:noNamespaceSchemaLocation="Sen2Like_GIPP.xsd">
    <Processing>
        <doGeometry>True</doGeometry>
        <doStitching>True</doStitching>
        <doGeometryCheck>True</doGeometryCheck>
        <doToa>True</doToa>
        <doInterCalibration>True</doInterCalibration>
        <doAtmcor>True</doAtmcor>
        <doNbar>True</doNbar>
        <doSbaf>True</doSbaf>
        <doTopographicCorrection>False</doTopographicCorrection>
        <doFusion>True</doFusion>
        <doPackagerL2H>False</doPackagerL2H>
        <doPackagerL2F>True</doPackagerL2F>
    </Processing>
    <Directories>
        <archive_dir>/data/HLS</archive_dir>
        <cams_dir>/data/CAMS/monthly</cams_dir>
        <cams_daily_dir>/data/CAMS/daily</cams_daily_dir>
        <cams_hourly_dir>/data/CAMS/hourly</cams_hourly_dir>
        <cams_climatology_dir>/data/CAMS/climatology/v1</cams_climatology_dir>
        <scl_dir>/data/AUX_DATA/SCL_maps_2.10</scl_dir>
    </Directories>
    <InputProductArchive>
        <coverage>0.5</coverage>
        <cloud_cover>11</cloud_cover>
        <!-- Local -->
        <base_url>/data/PRODUCTS</base_url>
        <url_parameters_pattern_Sentinel2>{base_url}/{mission}/{tile}</url_parameters_pattern_Sentinel2>
        <url_parameters_pattern_Landsat8>{base_url}/{mission}/{path}/{row}</url_parameters_pattern_Landsat8>
        <url_parameters_pattern_Landsat9>{base_url}/{mission}/{path}/{row}</url_parameters_pattern_Landsat9>

        <!-- Creodias -->
<!--        <base_url>https://datahub.creodias.eu/resto/api/collections</base_url>-->
<!--        <location_Landsat8>path={path}&amp;row={row}&amp;productType=L1TP</location_Landsat8>-->
<!--        <location_Landsat9>path={path}&amp;row={row}&amp;productType=L1TP</location_Landsat9>-->
<!--        <location_Sentinel2>productIdentifier=%25T{tile}%25</location_Sentinel2>-->
<!--        <url_parameters_pattern>{base_url}/{mission}/search.json?maxRecords=100&amp;_pretty=true&amp;cloudCover=%5B0%2C{cloud_cover}%5D&amp;startDate={start_date}&amp;completionDate={end_date}&amp;sortParam=startDate&amp;sortOrder=ascending&amp;status=all&amp;{location}&amp;dataset=ESA-DATASET</url_parameters_pattern>-->
<!--        <thumbnail_property>properties/productIdentifier</thumbnail_property>-->
<!--        <cloud_cover_property>properties/cloudCover</cloud_cover_property>-->
<!--        <gml_geometry_property>properties/gmlgeometry</gml_geometry_property>-->

        <!-- mixed landsat local, remote s2 -->
<!--        <base_url_s2>https://datahub.creodias.eu/resto/api/collections</base_url_s2>-->
<!--        <base_url_landsat>/data/PRODUCTS</base_url_landsat>-->
<!--        <location_Sentinel2>productIdentifier=%25T{tile}%25</location_Sentinel2>-->
<!--        <url_parameters_pattern_Landsat8>{base_url_landsat}/{mission}/{path}/{row}</url_parameters_pattern_Landsat8>-->
<!--        <url_parameters_pattern_Landsat9>{base_url_landsat}/{mission}/{path}/{row}</url_parameters_pattern_Landsat9>-->
<!--        <url_parameters_pattern>{base_url_s2}/{mission}/search.json?maxRecords=100&amp;_pretty=true&amp;cloudCover=%5B0%2C{cloud_cover}%5D&amp;startDate={start_date}&amp;completionDate={end_date}&amp;sortParam=startDate&amp;sortOrder=ascending&amp;status=all&amp;{location}&amp;dataset=ESA-DATASET</url_parameters_pattern>-->
<!--        <thumbnail_property>properties/productIdentifier</thumbnail_property>-->
<!--        <cloud_cover_property>properties/cloudCover</cloud_cover_property>-->
<!--        <gml_geometry_property>properties/gmlgeometry</gml_geometry_property>-->


        <!-- mixed landsat s2, remote landsat -->
<!--        <base_url_s2>/data/PRODUCTS</base_url_s2>-->
<!--        <base_url_landsat>https://datahub.creodias.eu/resto/api/collections</base_url_landsat>-->
<!--        <url_parameters_pattern_Sentinel2>{base_url_s2}/{mission}/{tile}</url_parameters_pattern_Sentinel2>-->
<!--        <location_Landsat8>path={path}&amp;row={row}&amp;productType=L1TP</location_Landsat8>-->
<!--        <location_Landsat9>path={path}&amp;row={row}&amp;productType=L1TP</location_Landsat9>-->
<!--        <url_parameters_pattern>{base_url_landsat}/{mission}/search.json?maxRecords=100&amp;_pretty=true&amp;cloudCover=%5B0%2C{cloud_cover}%5D&amp;startDate={start_date}&amp;completionDate={end_date}&amp;sortParam=startDate&amp;sortOrder=ascending&amp;status=all&amp;{location}&amp;dataset=ESA-DATASET</url_parameters_pattern>-->
<!--        <thumbnail_property>properties/productIdentifier</thumbnail_property>-->
<!--        <cloud_cover_property>properties/cloudCover</cloud_cover_property>-->
<!--        <gml_geometry_property>properties/gmlgeometry</gml_geometry_property>-->

    </InputProductArchive>
    <Geometry>
        <reference_band>B04</reference_band>
        <doMatchingCorrection>True</doMatchingCorrection>
        <doAssessGeometry>B04</doAssessGeometry>
        <references_map>/data/References/references_map.json</references_map>
        <force_geometric_correction>True</force_geometric_correction>
    </Geometry>
    <Atmcor>
        <use_sen2cor>True</use_sen2cor>
        <sen2cor_path>../sen2cor/process.py</sen2cor_path>
    </Atmcor>
    <Nbar>
        <nbar_methode>ROY</nbar_methode>
        <vjb_coeff_matrice_dir>/data/Belen</vjb_coeff_matrice_dir>
    </Nbar>
    <Sbaf>
        <adaptative>False</adaptative>
        <adaptative_band_candidates>B04,B11,B12</adaptative_band_candidates>
    </Sbaf>
    <Fusion>
        <predict_method>predict</predict_method>
        <predict_nb_products>2</predict_nb_products>
        <fusion_auto_check_band>B04</fusion_auto_check_band>
        <fusion_auto_check_threshold>0.1</fusion_auto_check_threshold>
    </Fusion>
    <Stitching>
        <same_utm_only>True</same_utm_only>
    </Stitching>
    <TopographicCorrection>
        <topographic_correction_limiter>4.0</topographic_correction_limiter>
        <apply_valid_pixel_mask>False</apply_valid_pixel_mask>
        <sen2cor_topographic_correction>True</sen2cor_topographic_correction>
    </TopographicCorrection>
    <DEMRepository>
        <dem_folder>/data/AUX_DATA/</dem_folder>
        <dem_dataset>COP-DEM_GLO-90-DGED__2022_1</dem_dataset>
        <src_dem_resolution>90</src_dem_resolution>
    </DEMRepository>
    <OutputFormat>
        <gain>10000</gain>
        <offset>1000</offset>
        <output_format>COG</output_format>
    </OutputFormat>
    <COGoptions>
        <interleave>PIXEL</interleave>
        <internal_tiling>1024</internal_tiling>
        <internal_overviews>128</internal_overviews>
        <downsampling_levels_10>2</downsampling_levels_10>
        <downsampling_levels_15>2</downsampling_levels_15>
        <downsampling_levels_20>2 3 6</downsampling_levels_20>
        <downsampling_levels_30>2 4 6 12</downsampling_levels_30>
        <downsampling_levels_60>6 12 18 36</downsampling_levels_60>
        <resampling_algo_MASK>MODE</resampling_algo_MASK>
        <resampling_algo>AVERAGE</resampling_algo>
        <compression>LZW</compression>
        <predictor>1</predictor>
    </COGoptions>
    <JPEG2000options>
        <lossless_jpeg2000>True</lossless_jpeg2000>
    </JPEG2000options>
    <Multiprocessing>
        <number_of_process>5</number_of_process>
    </Multiprocessing>
    <Packager>
        <quicklook_jpeg_quality>75</quicklook_jpeg_quality>
    </Packager>
    <RunTime>
        <dx>0</dx>
        <dy>0</dy>
    </RunTime>
</Level-2A_Ground_Image_Processing_Parameter>
